id,title,score,num_comments,post_hint,self_text,author_name,url
192e6bx,"What's in your cup? Daily discussion, questions and stories - January 09, 2024",3,11,,"What are you drinking today? What questions have been on your mind? Any stories to share? And don't worry, no one will make fun of you for what you drink or the questions you ask.

You can also talk about anything else on your mind, from your specific routine while making tea, or how you've been on an oolong kick lately. Feel free to link to pictures in here, as well. You can even talk about non-tea related topics; maybe you want advice on a guy/gal, or just to talk about life in general.",AutoModerator,https://www.reddit.com/r/tea/comments/192e6bx/whats_in_your_cup_daily_discussion_questions_and/
191rjcb,My new setup after improvising with mugs and strainers for far too long,98,15,image,,LizMixsMoker,https://i.redd.it/wq20nnfwa9bc1.jpeg
191vvsb,Yunnan Gold,55,24,image,"New to tea and this is my first venture into whole-leaf black tea.
I never knew black tea could be so sweet and kind,
These leaves smell like a cedar barrel used to age whiskey, minerally quarry dust, and the gentle grandmother who gardens. 
Peppercorns but they're hiding and they only pop out to give supporting funk to the pears and dried figs, dipped in honey.",Commercial_Nerve_564,https://i.redd.it/7hdlowzx5abc1.png
192dzur,What are your preferred vendors,3,5,,"For sourcing genmachia and hojicha tea. 

I'm getting back into tea and I know I really enjoy hojicha  and am curious about genmachia. Looking for places to buy it is tricky mostly because of not trusted quality or pricing.  

Just drop a store or brand to look for.  Thanks",thebeautifullynormal,https://www.reddit.com/r/tea/comments/192dzur/what_are_your_preferred_vendors/
191m27z,Brew tea like an Englishman,181,65,,"I have the following Reddit post written by a Jerry Kelly (no idea who this is) saved in my notes. I’ve cherished it all these years, and I share it with yall expecting it will provide equal satisfaction.

Brew tea like an Englishmen

On boiling the water

Cold water. Boil it once. Pour immediately into a teapot (If you are making tea for just yourself a mug is acceptable) Left over water in the kettle from last time? Throw that shit away.

On Teapots

This is never cleaned.

•	⁠Your friend thinks it would be a great idea to make cocktails in it? Throw it away.
•	⁠Sick in it? Throw it away
•	⁠Cleaned with anything other than just hot water? Throw it away. Your teapot should have a tea cosy, it is frowned upon if this is not chequered or floral. Bonus points if it matches your tea towels. Regarding the tea cosy: it is entirely acceptable, if not required, that you put it on your head and refer yourself as the Bishop. (Thanks to iamtheparty) As pointed out 'warming the pot' is a common practice whereby a small amount of boiled water is added to the tea prior to the teabags and swirled around. This is to make sure the tea is piping hot. In my opinion this is not strictly necessary but comes under the banner of 'cocking about'.

On Mugs

Teacups and saucers are only used to impress people that you do not want to come to your house. Use a mug. Mugs should be large, clean and most importantly yours * Not your Dad's * Not one that you found at the back of the cupboard at your office kitchen, even if it is the only one that does not smell like off milk. * It must be your own mug. There are many like it but this one is yours. You do not use it at 3am when you feel the need for bathroom tap water. You do not use it to keep your stationary in. You do not permit anyone else to use it. This mug is for tea and tea alone.

On Brands of Tea

Most people have a preference to which tea brand they like. Personally I'm a big fan of Yorkshire tea. PG tips, in my opinion, are of the devil. If someone were to hand me a cup of it, I would drink it. I'm British anything else would be impolite. We will cover etiquette later. Students Red label tea from Sainsbury's is fantastic for its cost. On Tea Leaves Some people have got the time to make loose leaf tea. Well done you. How was art school? I also like loose leaf tea. I drink it when I have nothing better to do or am at a tea shop and have the leisure time to deal with loose leaf. On the whole though, teabags will suffice. Yes they will. Stop it.

On Brewing

One teabag per person and one for the pot. Do not deviate from this method. You do not know better. Again taste varies for the strength of your tea. It is vital, VITAL that you do not over brew the tea. Some of the naturally stronger teas like Yorkshire should not be brewed for long as they will become bitter.

•	⁠Don't go and have a piss.

•	⁠Don't go and chat up that lovely bird in Finance.

•	⁠Don't play Angry Birds.

•	⁠STAY. THE. FUCK. THERE. If you have used a teapot, after a minute use a spoon to stir a few times. Brewing time should be around 4 minutes. Pour a little out into your mug to check the strength. If it is the colour of a dark ale such as Otter then the tea is at a good strength. If you have used a mug stirring regularly is fine. A good indicator of when your tea has reached a good strength is that you can only see the top 1/2 inch of the teabag due to the darkness of your beverage.

On Milk

People vary in their taste for strong tea. While brewing strength is important milk will also lower the strength of your tea. Add it slowly, preferably from a small jug rather than from an ungainly 6 pint milk bottle. You do not want to make a mess, that would be unseemly. Some people say that you must add milk first before adding tea. Some people also believe that pluto isn't a planet. Fuck those people. I have found that it makes very little difference. Much in the same way that if you were dropped into hot liquid you would scream the same amount as if you had boiling liquid poured onto you.

On Sugar

This component is widely debated. Some will take enough sugar to cause diabetes within a two mile radius. The great undecided populous will take somewhere between the most infuriating of measures (just a little bit) and what they call 3 teaspoons, which, due to the ever changing laws of science could mean practically any amount. Those enlightened few will ask for no sugar. This, apart from being a lot easier to measure, is also the most refreshing way to enjoy tea. I have yet to come across anyone who drinks tea with sugar to be anything less than abhorrent. Of course I say all this in jest. Drink tea as you like it. I would encourage you to try it without sugar for one week. If you remain stoically unaffected then you may return to your faux tea with my faux blessing. There is an exception. If someone has just heard some distressing news (like their aunt has just been severely injured by a swan), then sweet tea is the most appropriate prescription. Also, if you are an OAP, you are allowed to drink tea as sweet as you like with complete impunity. (Thanks Anon_is_a_Meme)

On Biscuits

Digestives or hobnobs. Rich teas are a sick joke and are a trap for those of you who dunk biscuits in your tea. If you must have chocolate coated biscuits then choose a dark chocolate variety, these will leave less chocolate on your fingers.

On Etiquette

•	⁠Tea is a social drink, before you make it enquire as to whether anyone else would like one in the vicinity.

•	⁠Drink at your leisure, coffee is for abusing when deadlines approach

•	⁠Biscuits should be served on a side plate

•	⁠If you make any mess while making tea clear up after yourself

•	⁠It is always best to throw any boiled water and any unused tea away after using the kettle and teapot

Jerry kelly",NoPart1344,https://www.reddit.com/r/tea/comments/191m27z/brew_tea_like_an_englishman/
1926guu,Identifying help?,9,9,,"Picked this up in a garage sale, years ago, and have cherished it simply because it’s cool. However, after a nice hour-long trip down the yixing rabbit hole, if you will, It got me wondering, is mine one? It surely says it is. Any info or translations would be wonderful. TIA",imanazz,https://www.reddit.com/gallery/1926guu
192jt4z,Jasmine Green Tea,1,3,,"Hey, 

I've recently started drinking Jasmine Green tea and wanted to know the best versions you can buy online in the UK?

They are mainly to be sipped at work so teabag versions would be appreciated :)

Currently having twinning but know there is probably something better!

&#x200B;

&#x200B;

&#x200B;",MerrowStreet,https://www.reddit.com/r/tea/comments/192jt4z/jasmine_green_tea/
1929nru,Where to buy a shiboridashi or other teaware in Japan?,4,2,,"Wanting to buy a shiboridashi and other kinds of teaware in Tokyo, Osaka, and Kyoto. Any suggestions on shops?",the-renaissance-man1,https://www.reddit.com/r/tea/comments/1929nru/where_to_buy_a_shiboridashi_or_other_teaware_in/
1921sr7,I've Started Custom Ordering Yan Cha (story),11,2,,"This year and last year I have asked my award winning Yan Cha making friend to do a custom   
roast.  


Since first coming to China I have been looking for a high quality fully roasted yan cha. While I have found plenty of high quality teas they tended to be low to medium roast, very few were high roast. Infact in general very few teas were high roast.

I asked many makers why there was so little high roast as time passes Im able to piece to together the more and more of the picture. High roasts use to be the norm but recently they have fallen out of favor, in part becuase new drinkers dont want to wait for the heat to cool off they prefer to enjoy more quickly. The focus now is more on the aroma as well.  Giving a tea a full roast is also a little risky because you risk over roasting it. Once it is over roasted then you cant go back.

That being said I still wanted high quality yan cha at a fully roast. So after countless trips to Wuyi and even living in the area I decided I was going to need to custom order the tea.

I reached out to Mr. Wu. Mr.Wu was my first contact in Wuyi Shan way back in 2017 and competition wise, the most successful. He has won countless awards, mostly for his rou gui, and done quiet well for himself.

[Mr. Wu being regonized. ](https://preview.redd.it/86hibx6udbbc1.jpg?width=1620&format=pjpg&auto=webp&s=c5ccc06404c36540f8a0a22c6fb38d32449aef88)

I reached out to him because three years prior he had produced a Rou Gui that was at the level I wanted and delicous. I asked him to do it again and he agreed.

A month or so later he told me the tea was ready. He sent me a sample and it was an amazing tea. It was complex and full of flavor. Tasting like warm apple pie. There was one problem...it was a medium roast. I almost considered just accepting the tea the way it was. But no....I wanted a full roast. I asked him to roast it again and he agreed and a week or so later sent me a higher roast. Still not satisfied I asked him to roast it again. He agreed but more hesitantly.

""Are you sure?""""Yes""""This is not what people usually want""""I know. But this is what I want""

He roasted it again, sent me the sample.......And it was amazing! The body was full, thick but smooth with light tannins. Even he said it tasted like red wine, which it did.

The cool thing was that since it was fresh off the charcoal the tea still had heat. When yan cha is made it needs a resting time to lose the heat. with such a new tea i got to taste the affect of a tea having too much heat. The flavors were strong and a bit fuzzy, not very clear. As time went on the flavor profile settled, became more complex and clear and a beautiful aroma emerged.

This year I asked for the same roast but with Shui Xian. Because Shui Xian is a larger leaf it will carry the roast differently. This year he knew exactly what I wanted and roasted it to just the right level on the first try. While still having the heat, the aroma was like stepping into a coffee shop full of freshly roasted beans. Im excited to see how the profile will develope as the tea cools.

I applauded him after tasting the tea.

""Few people would dare make such a roast."" He told me ""It takes great skill to do it this well.""

He was being a little boastful, but I didnt mind. He had earned it.

&#x200B;

https://preview.redd.it/lotg8q98dbbc1.jpg?width=4032&format=pjpg&auto=webp&s=12c9ccb6a365b074e979a6a1c949f1fa18ee5f7c",sweetestdew,https://www.reddit.com/r/tea/comments/1921sr7/ive_started_custom_ordering_yan_cha_story/
191w7h1,Drinking 20 year old tea,24,7,,We've had this can of tea since I was like 4 or 5 and I have no idea what it is. It's very nice though so probably still good to drink?,Thatignorantmoos,https://www.reddit.com/gallery/191w7h1
191ysik,My first White2Tea order arrived + my tea tray! (With 2020 Big O v3 impressions),17,10,,"A big day in my tea journey as my new tea tray arrived and my first order from White2tea also came in!

The tea tray was an inexpensive one from Amazon with a plastic bottom, but I like that for easy cleaning, and no risk of it leaking. Plus I like that the design has a bit of personality.

I ordered 25g samples of several different teas from White2tea. I'm trying to figure out what I like. I was pleasantly surprised to find out they included a sample of their 2020 Natural Redhead as well.

I couldn't decide which one to try first, but I wanted something that would be agreeable to my parents. So I tried the 2023 Big O V3.

I brewed about 5g in a pseudo-gongfu style. A quick 5 second rinse, and an initial steep of about 7 seconds. I'm brewing 250 ml of tea so I can serve some to my parents.

First of all, the colour of the tea is beautiful. Orangey red, like a sunset over the ocean. Gorgeously clear. And my goodness the flavour of Big O v3 is just magnificent. Ripe pu'er warmth with just a touch of pleasant funk, but then the citrus notes really liven it up in a way that isn't overpowering, just complementary. Spectacular.

The second steep, about 15 seconds resulted in even more flavour, and the body of the tea became even richer. A long lingering finish like a warm hug. Perfect for a freezing cold day here in Calgary, Canada.

I'm saving the third steep for my best friend who is coming over soon. But as my first taste of what white2tea has to offer, I'm just thrilled. I can't wait to try the res.",IronCavalry,https://www.reddit.com/gallery/191ysik
192fagv,Double walled teapot?,1,10,,"Hello everyone,
I've looked around both on the internet and on this sub and to my surprise, I haven't been able to find a double walled teapot. I've tried a french press, which worked great at brewing and keeping the tea hot, but obviously enough (for someone a bit brighter than I) the second cup was overextracted. Have you guys had any luck? I know I could use a thermos, but I've already got one I use for water and I'd really like something nice to pour from.",NyxWhiteFang,https://www.reddit.com/r/tea/comments/192fagv/double_walled_teapot/
192f6yc,Is a tea bag still ok if water got spilled on it (it's still in the package),1,0,,This morning i was asked to make tea by my s/o and since I was still tired and shaky I ended up spilling boiling water on myself the counter and it soaked a whole roll of paper towels and my last package of green tea I promptly got it out of the water I wanted to have it with my lunch today and was wondering if it would be ok to still use it after it got soaked with water on the counter if I use it today,chiipersocom,https://www.reddit.com/r/tea/comments/192f6yc/is_a_tea_bag_still_ok_if_water_got_spilled_on_it/
191vb9n,"Oolong with a splash of milk, honey, and my first homegrown Calendula",22,4,image,I don't have fancy oolong so Twinings will have to do. Very nice with heavy floral notes. So proud of my new flowers too 🥰,PracticeJealous193,https://i.redd.it/ffujfb6s1abc1.jpeg
19235zi,"I am looking for this tea pictured below in Pittsburgh, PA area. Any suggestion which stores might have it?",7,17,image,,Objective_Move_847,https://i.redd.it/lqk358e8pbbc1.jpeg
1923u4y,Yunnan sourcing haul,7,6,image,"Just got into tea, and I’m loving the white teas",Kitchen_Film1904,https://i.redd.it/91ka59xvubbc1.jpeg
191v3jc,cant seem to figure out what this tea is,20,24,image,"its very very sweet and thick, grandfather gave it to me in a crumpled up paper bag with nothing written/printed on it but he’s since passed so I cant ask",AdNo1495,https://i.redd.it/a1txees90abc1.jpeg
192dwlh,Did tetley discontinue blueberry green tea?,1,0,,I live in canada and I used to be able to find tetley blueberry green tea in most places now I cant find it anywhere and even Amazon doesn't have any.,TARhuman,https://www.reddit.com/r/tea/comments/192dwlh/did_tetley_discontinue_blueberry_green_tea/
1929k5t,A ginger tea without the aftertaste??,2,12,,"Hello! I am looking for a good ginger loose leaf or bagged tea that doesn’t have that weird throat coat/echinacea/turmeric/oddly sweet back of the throat aftertaste. You know the thing I’m talking about? The Yogi ginger tea has it and I cannot stand it. I would love recommendations for a brand that just has straight ginger, plain and simple. Thanks!",kumquatfather,https://www.reddit.com/r/tea/comments/1929k5t/a_ginger_tea_without_the_aftertaste/
192coee,I have received a blend of rooibos green tea which contains cacao and coffee beans. The package sas it does not contain theine but could the coffee beans have an effect on my sleep ?,0,7,,,Leif_Millelnuie,https://www.reddit.com/r/tea/comments/192coee/i_have_received_a_blend_of_rooibos_green_tea/
191utx0,Gifted this box of Tea Fortē for the holidays. How do you all feel about this brand?,12,23,,"Over the holidays a relative gifted me this box of Tea Fortē Winter. I’ve never used the brand before but so far I’m enjoying the selection that came with this box (black currant & harvest apple especially). I was wondering if any of you have bought from this company before, and what you might recommend from them if you’ve enjoyed their products.",ObscuredOragnutan,https://www.reddit.com/gallery/191utx0
191y8pu,Da Guan Ginseng Oolong Tea + Blueberry Pie 🙀,7,2,image,"Honestly, any tea will go with blueberry pie. 😋",R1Alvin,https://i.redd.it/tytg1cmpmabc1.jpeg
192a7hn,Bug bitten oolongs in Belgium/Netherlands/Germany/ France,1,2,,"I’m in search of Gui Fei Oolong, also known as bug bitten Oolongs and I’m particularly interested in finding online shops or vendors that ship from Belgium, Netherlands, Germany, or France.",CreditPsychological4,https://www.reddit.com/r/tea/comments/192a7hn/bug_bitten_oolongs_in_belgiumnetherlandsgermany/
191mxoj,I just drank Black Bud Golden Biluochun,20,2,,"I met a tea seller a few days ago. He said he was half a tea farmer. Why did he say he was half a tea farmer?  Because he has his own tea mountain, but not much. More often, he is a tea lover.  The tea purchased this time is new tea in 2023, only the buds picked in the first spring.  As soon as the tea arrived, I couldn't wait to start brewing it. The picture is the process of brewing it just now. You can see the color for yourself. Its taste is different.  When I brewed it for the first time, its color was relatively light (perhaps due to my habit of brewing quickly), so the soup had a light nectar aroma.  After brewing for the second time, the tea soup stayed for 5-10 seconds. This time, the color of the tea soup was more mellow. There was only a faint floral and fruity aroma in the mouth. When it entered the throat, there was a fruity honey aroma returning, which was a light sweetness.  The levels are completely different.  It can be regarded as the relatively delicious black tea I have ever drunk.",towerboys,https://www.reddit.com/gallery/191mxoj
191cym6,New tray :),120,19,,,Negative_Piglet_8428,https://www.reddit.com/gallery/191cym6
191q8pb,Tie Guan Yin?,13,18,image,"Can anybody tell me about Tie Guan Yin? What to expect in terms of flavor, etc., especially for someone who up until now has only drank Japanese green teas. I understand from a cursory Google search that it is an oolong (correct me if I’m wrong). I know it will taste stronger than the senchas I usually drink, are oolongs generally bitter? Brisk? Grassy?

I found it at the bottom of my tea drawer, so I’m not sure how old it is. I believe it must belong to one of my family members who used to be a big oolong drinker.

I see on the back it recommends brewing at 90°-95°C. Anything else I should know?

Whatever you can tell me is great. Thanks! :)",lashvanman,https://i.redd.it/pp5dkhrr19bc1.jpeg
191lhsz,Loose leaf tea collection,23,5,image,"Here is a smallish sampling of my loose leaf tea. In there you have english breakfast, earl grey, turmeric peach black, salted caramel black, bourbon vanilla rooibos, jasmine dragon pearls, genmaicha, masala chai, oolong, cold and flu herbal, white rhino matcha. 

My favs at the moment are the english black and earl grey for morning and rooibos in the afternoon.",freddie79,https://i.redd.it/bapuaresz7bc1.jpeg
191a374,Hibiscus is straight up addictive... Orange peels really compliment it very well,170,33,image,,Stoned_Lumber,https://i.redd.it/wki7e37hn4bc1.jpeg
191g0t6,Review: duck shit,60,44,image,"Tried the Duck Shit Oolong without a thermometer, gauging the temperature by feel. Steeping time was a quick 10 seconds with a flash wash, followed by subsequent steeps of 10 seconds each. Not bad, had a slight bitter undertone, but it wasn't as sweet as I hoped. The search for a sweet oolong continues. Any recommendations for oolongs with a sweeter profile?",CreditPsychological4,https://i.redd.it/t89hzngda6bc1.jpeg
192cmeg,Am I in trouble?,0,3,,,MintyRabbit101,/r/Puerh/comments/192cm3d/am_i_in_trouble/
191x50q,Best jasmine tea you ever had?,4,5,,Just got the yunnan sourcing imperial grade Jasmine green tea pearls. It’s pretty good. I love Jasmine tea and wanted to know if there are better brands out there that I should try?,Ok_External2609,https://www.reddit.com/r/tea/comments/191x50q/best_jasmine_tea_you_ever_had/
191zg74,"Where can I purchase vacuum packed, pre-portioned loose leaf tea in the US?",2,3,self,I watched this video and at the [8:25](https://youtu.be/c-MKwjX6Nc0?t=503) mark he shows tea from China that's vacuum sealed and pre-portioned. Does anyone know where to buy this in the US?,sfitzer,https://www.reddit.com/r/tea/comments/191zg74/where_can_i_purchase_vacuum_packed_preportioned/
191nzip,A friend gifted me a new batch of Pu'er tea – robust and featuring tender buds,8,9,,"This is a new Pu'er from 2023, very robust with almost no musty taste, featuring a thick tea soup. You can feel the sticky sensation it leaves between your teeth; I even sense a bit of resemblance to black tea. The leaves have a slight oily texture, very sweet but not sugary – it's more of a lingering sweetness. Since it's a new tea, the price is reasonable. I'm considering stocking up on this cake.",orientaleaf,https://www.reddit.com/gallery/191nzip
191qxj8,Recommendation for best tea that…,4,22,,"I just found this Reddit and am thrilled, but not sure I have the expertise to participate much, though I’ve been drinking tea for most of my 6 decades of life. My objective for so many years was simply to wake up and function well and prefer tea. I’ve tried to be a connoisseur at times but after reading these posts I fell way short, haha. 

Anyway, I’m interested in suggestions for the best full-bodied, tea with buttery and caramel notes (not sure if that is proper flavor verbiage but that’s what I’m looking for), and not a lot of bitterness or astringency; moderate to strong in flavor and moderate to high caffeine. 

Currently in my stock is Vadham Daily Assam, Tealyra: Dragon Lychee pearls, Tarry Lapsong Souching Superior, Vintage Pu-ehr aged 20y, and Matcha Iri Sencha. I also had some Jasmine. I also have a powdered green matcha from Japan. 

None of the above teas is exciting. I tend to prefer Asian flavors but they aren’t full-bodied enough, or are too strong in flavor. Not fond of English Breaksfast tea as it seems too astringent at times. 

I think ideally what I would like is an Oolong on steroids, haha. Any suggestions?? ",RUMyMuse,https://www.reddit.com/r/tea/comments/191qxj8/recommendation_for_best_tea_that/
19221lq,Brand recommendations for Korean Barley Tea,0,2,,"I went to Cast Iron in Staten Island. For those that don't know what it is, it's a Korean bbq spot. They had this really good tea and I believe it's Korean barley tea. I was wondering if there's a brand out there that sells this, especially in NYC if there's a store that may have this type of tea. Either loose leaf or bagged.",Ready-Bet-4592,https://www.reddit.com/r/tea/comments/19221lq/brand_recommendations_for_korean_barley_tea/
191j5z5,Yunnan Jin Zhen at workplace,11,1,image,2023 Yunnan Jin Zhen tea session at my workplace .,thenobleone13,https://i.redd.it/sof6os52c7bc1.jpeg
190to9o,Guess the Tea - Level 1 Easy,437,26,,https://www.instagram.com/omniiac,Omniiac,https://www.reddit.com/gallery/190to9o
1911unh,"Saw someone post their tea adventures in Japan, so here's mine too!",122,9,,,eggwithrice,https://www.reddit.com/gallery/1911unh
191fxr8,Aging shou pu’er,14,15,image,"Exciting mail day for me. A new bing arrived that I ordered over the weekend. I had read a ton of great reviews about what a killer value this tea is. (Only 58 RMB here in China - $8.30usd). Anyway, it's a 2022. Do you typically age your shou pu'er for 5 years ... or just dive right into it given it's already ""ripened"" ... should I just stick it in my clay tong storage thingie and forget about it, or just start drinking it?

Trying to get a sense of the need to age shou (vs sheng, which I know needs aging)",twbivens,https://i.redd.it/pdpij7td96bc1.jpeg
