id,title,score,num_comments,post_hint,self_text,author_name,url
18z66ap,Water or tea bag first?,0,2,,"Do you pour the water then add the teabag or do you add the teabag and then pour the water?

[View Poll](https://www.reddit.com/poll/18z66ap)",matfat55,https://www.reddit.com/r/tea/comments/18z66ap/water_or_tea_bag_first/
18xrid3,Found a feather in my red dawn black tea from teasource 🤮,249,123,,"I found a BIRD FEATHER in my tea…

Red dawn black tea from teasource. I thought it was a weird looking leaf at first. Nah. Its a hollow bone. With feather material on it. A small “down” type feather of a bird. In the tea.",No-Guess-4644,https://www.reddit.com/gallery/18xrid3
18ynwu9,Glass or metal alternative to Adagio IngenuiTEA (gravity infuser)?,2,5,self,"Hi all, 

Maybe this is a lost cause, but are there any non-plastic gravity infusers out there similar to the Adagio IngenuiTea [https://www.adagio.com/teaware/iced\_ingenuiTEA\_teapot.html](https://www.adagio.com/teaware/iced_ingenuiTEA_teapot.html)? I have used it for years but I am trying to remove plastic out of my life as much as possible, especially where hot liquids are concerned. ",nisiandrew,https://www.reddit.com/r/tea/comments/18ynwu9/glass_or_metal_alternative_to_adagio_ingenuitea/
18y0vf2,I’ve never had anything but tea from Amazon. What is your favorite here?,67,64,image,,LicoriceTattoo1,https://i.redd.it/81zmi25qwbac1.jpeg
18yi4l4,Long Steepable Teas,4,5,,"I have been drinking some Caykur Turkish tea and appreciating how it can steep for a long time without negatively affecting the end result. Are there other teas out there that can steep for a long time, say 30 minutes without ruining the tea?",slurryer,https://www.reddit.com/r/tea/comments/18yi4l4/long_steepable_teas/
18y525v,Simple tea suggestions,33,15,image," I’ve liked tea for some time but I just get Walmart morning tea time and cheap pepper mint tea bags but I’ve grown a bit tired. I love tea in the mornings and at night as it really helps me sleep and wake up however I’ve grown a bit tired of my generic Walmart teas.
I don’t have much time in the mornings and I’m lazy at night, so I want some stuff that I can just put into a cup of boiling  water, leave for a few minutes/until it cools - nothing to fancy and preferably cheap as well as caffeine free.",Successful_Ad_8790,https://i.redd.it/eju66w68xcac1.jpeg
18yjk5l,How do I intelligently describe the teas I try for the online tea group I facilitate?,3,11,,"I was a coffee hound for years, but I have now seen the light and am getting into tea. I recently started a small online group about the tea and tea shops in my area, and I would like to create interesting, valuable posts for the members to enjoy. However, I'm finding that I really do not know how to describe the teas that I'm trying and posting about each day. How do I describe the smell and taste of teas? Can you point me to a reputable resource on this topic? And if there is any other information that you think would help me create fun and useful posts about local tea and tea shops, please do share!",PhoenixTheReader,https://www.reddit.com/r/tea/comments/18yjk5l/how_do_i_intelligently_describe_the_teas_i_try/
18yw3wp,Can someone PLEASE help me find where I can buy this exact tea?,0,6,image,It was so delicious.,WarAsleep,https://i.redd.it/cmop0bcudjac1.jpeg
18yq981,looking for a shop for a high quality porcellain teapot,1,3,,hi. wanna buy myself a real nice high quality chinese teapot for my green tea. cant have yixing clay as i drink a lot of different teas. cant find a decent shop though (location based search engine results suck sometimes...),coolman20012,https://www.reddit.com/r/tea/comments/18yq981/looking_for_a_shop_for_a_high_quality_porcellain/
18yxv34,Do you have experiences with thea from Aliexpress?,0,8,,I'm seeing tea advertised on the site. Some have good reviews but I'm still afraid the shipping could damage the leaves or maybe the quality isn't really good. Has anyone ordered from there?,Moflete,https://www.reddit.com/r/tea/comments/18yxv34/do_you_have_experiences_with_thea_from_aliexpress/
18yje8i,Recommendations for anji bai cha?,2,5,,"I fell in love with the anji bai cha from Three Brews Tea. Unfortunately, it looks like they went out of business? I tried ordering from another vendor and it wasn’t as good…

Where is your favorite place to order anji bai cha from?",dragoncowgirl,https://www.reddit.com/r/tea/comments/18yje8i/recommendations_for_anji_bai_cha/
18ycmro,"What's in your cup? Daily discussion, questions and stories - January 04, 2024",6,20,,"What are you drinking today? What questions have been on your mind? Any stories to share? And don't worry, no one will make fun of you for what you drink or the questions you ask.

You can also talk about anything else on your mind, from your specific routine while making tea, or how you've been on an oolong kick lately. Feel free to link to pictures in here, as well. You can even talk about non-tea related topics; maybe you want advice on a guy/gal, or just to talk about life in general.",AutoModerator,https://www.reddit.com/r/tea/comments/18ycmro/whats_in_your_cup_daily_discussion_questions_and/
18yn12j,Tea Flavor Combinations,1,1,,"Hi First time poster here,

I’m starting to see myself drink more tea and was hoping if anyone knows of dos or donts with tea base flavors .

I.e(black tea and green tea is no good but chamomile and peppermint are good)

Any feed back would be appreciated,Thank You !😁😅",Roasted_Grizz1016,https://www.reddit.com/r/tea/comments/18yn12j/tea_flavor_combinations/
18yrwyz,"College Focus Group, Korean tea fans!",0,0,link,,cedmorales,/r/hanguk/comments/18yrqjy/college_focus_group_coffee_and_tea_fans/
18y9u26,Lessons learned,5,6,,"Yesterday I decided I wanted some hot tea. Mistake #1, I got distracted while brewing it and let it steep too long. Mistake #2, it was 4:00 pm. The tea, BTW was loose leaf Sencha. I could hardly drink it because it was so bitter.  I usually go to bed  between 8:30 and 9:00 pm because I get up between 1:45 and 2:30 am. I didn't relax until 12:00 am and made myself get out of bed at 4:00. 

For those who might ask why I get up so early,  I have a disabled family member I have to make sure is situated before I can get myself ready to go to work by 8.",Grammy0812,https://www.reddit.com/r/tea/comments/18y9u26/lessons_learned/
18y7vb5,I have returned to the embrace of Dancong,10,6,,"Even as a Chinese person, I was introduced to this rabbit hole by online tea-head, and my first (dignified) tea was Dancong tea.

Recently, I have found myself back at the beginning.  I acquired several Snowflake Dancong, including a rare aromatic variety – the Pomelo Blossom fragrance.

I recommend that everyone should employ the Gongfu brewing for Dancong tea. Originating from the Chaozhou region of Guangdong, this method is tailor-made for Dancong Oolong.

I really like the  fragrance of Dancong!",Calm_Professor4457,https://www.reddit.com/r/tea/comments/18y7vb5/i_have_returned_to_the_embrace_of_dancong/
18yllsm,"Getting gifted a Japanese tea set, what to do with it",1,2,,Title. Getting gifted a Japanese tea set. Are there specific styles of brewing/specific teas I should use? I have a gaiwan and a Chinese tea set that I usually use for my oolongs and whites. Help me with this new gift!,MikeyLG,https://www.reddit.com/r/tea/comments/18yllsm/getting_gifted_a_japanese_tea_set_what_to_do_with/
18yljpb,Steeping Carafe Question,1,6,,My coffee pourover set (Hario V60) came with this carafe with a plastic strainer built into the lid. Would this be sufficient for making loose leaf teas for 2-3 people (after cleaning out the coffee smell of course) or would I need to get a teapot with a finer mesh strainer?,shaheertheone,https://www.reddit.com/gallery/18yljpb
18yq1p2,Is winter Shan Lin Xi mildly astringent?,0,0,,"Recently I received a 2023 winter Shan Lin Xi from Floating Leaves. Most, if not all, of my brews have some astringency. This is not at all a complaint, I am simply curious if it's a natural part of the tea or if the way I'm brewing it is pulling it out. If it's caused by brewing I will continue experimenting, if it's not then I will enjoy it how it is.

Thank you",oenomal,https://www.reddit.com/r/tea/comments/18yq1p2/is_winter_shan_lin_xi_mildly_astringent/
18yq1l0,Is winter Shan Lin Xi mildly astringent?,0,3,,"Recently I received a 2023 winter Shan Lin Xi from Floating Leaves. Most, if not all, of my brews have some astringency. This is not at all a complaint, I am simply curious if it's a natural part of the tea or if the way I'm brewing it is pulling it out. If it's caused by brewing I will continue experimenting, if it's not then I will enjoy it how it is.

Thank you",oenomal,https://www.reddit.com/r/tea/comments/18yq1l0/is_winter_shan_lin_xi_mildly_astringent/
18yejsi,Best gooseneck kettles?,2,6,,Looking for recommendations for best electric or stove top gooseneck kettles,teatea94,https://www.reddit.com/r/tea/comments/18yejsi/best_gooseneck_kettles/
18xph20,Ordered these just a little too late for Christmas but it was worth the wait.,76,37,image,,nstntmlk,https://i.redd.it/jg13rz3hl9ac1.jpeg
18yi5ua,Tea table corner,1,0,image,"This is my tea table in the corner of the living room – it's like my ""tea paradise""! Here, I enjoy sipping tea, chatting, and even filming short videos. It feels relaxed and cozy, making it one of my favorite spots. This corner always gives me a sense of ease, especially when I'm having tea. I love the atmosphere here and enjoy sharing this little tea haven of mine. Do any of you have a similar cozy spot? Let's exchange and share our tea spaces!",orientaleaf,https://i.redd.it/6xa8rbn6hgac1.jpeg
18xodli,"I didn't know this was what it was called. ""Foggy crack""",80,13,,"I've definitely seen it on the surface of my tea before but I never considered that it had a name. I don't think it's an actual indicator that the tea has been brewed well (unless there's something I don't know 👀)

Source: 50 Tea Recipws from the Dutchess https://tapas.io/series/50-tea-recipes-from-the-duchess/info

I've been having a lot of fun guessing which teas she'll serve in all the different situations in this manhwa and I'm pleased to have been correct a decent number of times.",DemeterIsABohoQueen,https://www.reddit.com/gallery/18xodli
18ycli2,Vietnamese Lotus Tea,2,3,image,"Hi fellow tea friends,

my boyfriend brought these teabags back from Vietnam and I was wondering if anybody has had lotus tea and would like to share their experiences/knowledge about it and also about Vietnamese green tea in general. On this subreddit I only ever saw Japanese and Chinese green tea mentioned. Vietnam probably isn't a top tier tea country, or is it maybe too small to produce a lot for the world market?",cinderellarockefella,https://i.redd.it/0tdwuavd8fac1.png
18yq3hn,Are winter Taiwanese oolongs mildly astringent?,0,1,,"Recently I received a 2023 winter Shan Lin Xi from Floating Leaves. Most, if not all, of my brews have some astringency. This is not at all a complaint, I am simply curious if it's a natural part of the tea or if the way I'm brewing it is pulling it out. If it's caused by brewing I will continue experimenting, if it's not then I will enjoy it how it is.

Thank you",oenomal,https://www.reddit.com/r/tea/comments/18yq3hn/are_winter_taiwanese_oolongs_mildly_astringent/
18yq1yy,Is winter Shan Lin Xi mildly astringent?,0,0,,"Recently I received a 2023 winter Shan Lin Xi from Floating Leaves. Most, if not all, of my brews have some astringency. This is not at all a complaint, I am simply curious if it's a natural part of the tea or if the way I'm brewing it is pulling it out. If it's caused by brewing I will continue experimenting, if it's not then I will enjoy it how it is.

Thank you",oenomal,https://www.reddit.com/r/tea/comments/18yq1yy/is_winter_shan_lin_xi_mildly_astringent/
18y27lk,Ideas for brewing tea in non permissive environment.,8,48,,"Hi folks,
I'm new to tea. I just bought some tea from Beautiful Taiwan Tea, in indiana. I'm enjoying it so far, clumsily brewing it. I want to be able.to drink it at work.

I work in a place where I can't bring in anything but plastic, possibly a metal thermos, under 24 oz. I may be able to get away with a wire strainer, maybe not. I also can't bring in tea, or any liquid that isn't in a sealed container from a store. So no brewing tea and bringing it along. 


I also won't have access to any way to make hot water other than a microwave.

I'm wondering if anyone has any ideas for how I could brew tea and drink it without tea leaves in my mouth.

My only idea so far is to put my tea in bags and brew that way. But for teas that need to be rinsed, it would be tedious to microwave water, rinse, tools, and microwave more water. I'd probably need a large cup of hot water, and a second smaller cup.

If anyone has any ideas or if they know of any like nested plastic cups or anything I could use to brew without it being a pain in the but, I'd he grateful for you sharing.

Cheers.",HecticBlue,https://www.reddit.com/r/tea/comments/18y27lk/ideas_for_brewing_tea_in_non_permissive/
18yq2yi,Are winter Taiwanese oolongs mildly astringent?,0,7,,"Recently I received a 2023 winter Shan Lin Xi from Floating Leaves. Most, if not all, of my brews have some astringency. This is not at all a complaint, I am simply curious if it's a natural part of the tea or if the way I'm brewing it is pulling it out. If it's caused by brewing I will continue experimenting, if it's not then I will enjoy it how it is.

Thank you",oenomal,https://www.reddit.com/r/tea/comments/18yq2yi/are_winter_taiwanese_oolongs_mildly_astringent/
18ylgzi,Do we know who the Tea Culture Girl is?,0,0,self,"I keep seeing her on a few different tiktok accounts that repost her videos, just wondering if anyone had the sauce. Thanks![](https://www.tiktok.com/@tea.chinese.culture/video/7316522446675299617?lang=en&q=tea%20culture&t=1704396168987)",ItsKingKraig,https://www.reddit.com/r/tea/comments/18ylgzi/do_we_know_who_the_tea_culture_girl_is/
18yd1uq,Tieguanyin vs Lapsong Souchong,1,5,,"A while back I made a post in search for a specific Smokey/burnt tea flavour. The comments told me it was Lapsong Souchong. Today I found another bag of the same tea I had. I translated the packaging and it said tieguanyin.

What’s the difference between these tea, taste wise.",Money-Note-8359,https://www.reddit.com/r/tea/comments/18yd1uq/tieguanyin_vs_lapsong_souchong/
18xrrj2,New Nixing teapot from mud and leaves.,26,3,image,I have been drinking a lot of liu bao lately and wanted to get something aside from my gaiwan. I grabbed this Brown Shipiao Nixing Teapot 坭兴石瓢壶 by Wu Sheng Sheng from mudandleaves. Looks much nicer in person and durable. I plan to dedicate this to liu bao on my weekends.,42AMSW,https://i.redd.it/m18134zm1aac1.jpeg
18xgz1x,Why does my loose leaf look different than other loose leaf teas I’ve bought?,114,47,image,I’m used to loose leaf tea resembling cut up leaves. This almost reminds me of instant coffee. What’s the deal? Thanks.,GrungeIsFun,https://i.redd.it/53et2xt6k7ac1.jpeg
18y0zmi,All day steep?,8,17,,I'm a truck driver trying to cut out the sugary drinks. Would it be advisable to throw some loose leaf in my 30oz yeti tumbler and just keep topping off with more water whenever I stop throughout the day?,schwedybawlz,https://www.reddit.com/r/tea/comments/18y0zmi/all_day_steep/
18xy7xw,I had grapefruit & hibiscus oolong,10,3,image,"I have a jar full of dried hibiscus leaves and thought I'd mix them with my grapefruit oolong. 
Abit tart at the beginning but a wonderful aftertaste. Is it so long since I've shared with us community that I had a reason to do so.",Otono_Wolff,https://i.redd.it/xzmrgbv6cbac1.jpeg
18x82dg,What would happen if someone were to crack this open and try to make tea from this?,312,55,image,,No-Manufacturer1364,https://i.redd.it/tkue4lxuz4ac1.jpeg
18xm486,Added a conversion chart to my station!,28,14,image,Because I tasted today what a difference 80 C vs 65 C makes for delicate green teas! Feeling a strangely high sense of accomplishment after sticking this on the wall 😂,KarrotLover,https://i.redd.it/q1srazd2v8ac1.jpeg
18xkouy,aw yeah candle warmer,30,7,image,got this candle warmer for christmas and immediately figured out a secondary use for it. also it makes my tea look like a glowing magic potion.,iphany,https://i.redd.it/y1ysgz5oj8ac1.jpeg
18xsbau,Gaiwan with Honey Flower!,11,4,image,"^^ I just wanted to nerd out about how tasty this tea is! Sweet, Floral, peachy, and just a touch of roasty to round out the steepings! Im beyond in love with this Dang Cong.
   Its a 2023 tea produced by Mr. Huang Shu Wei in Chao An district of Chaozhou City in Guangdong Province. It’s a two leaf and one bud pick of the Mi Lan Xiang cultivar growing at approximately 1,300 feet. (information provided by tea seller) 
  The steeping in the cup is its 6th round and still amazing <33",NocturnalHypnos,https://i.redd.it/u4grgedj5aac1.jpeg
18y1na0,Looking for Electric Kettle Recommendations!,2,6,,"I just ruined my stovetop kettle, so I am looking into getting an electric kettle with temperature controls.  Any suggestions?",Connect_Pirate_7007,https://www.reddit.com/r/tea/comments/18y1na0/looking_for_electric_kettle_recommendations/
18y16ai,Anyone know how to make Tim hortons steeped tea at home?,2,2,,Not sure how they do it but my wallet will thank me if I can learn to recreate it 😂,Joodermacho,https://www.reddit.com/r/tea/comments/18y16ai/anyone_know_how_to_make_tim_hortons_steeped_tea/
18y5j6p,What tea is good for clay tea pot and what isn't?,1,10,,"I was gifted a clay tea pot but not sure what I can brew in it. Also, is it true that you can only brew 1 tea per clay tea pot?",LandOnlyFish,https://www.reddit.com/r/tea/comments/18y5j6p/what_tea_is_good_for_clay_tea_pot_and_what_isnt/
18y5bh3,Alternative brewing methods,0,2,,"Hi, I never really liked tea and usually drink coffee. But a few years ago I discovered that it’s because I’ve been brewing it in what I call “the google way” or the English way. as in add a certain amount, steep for 5 minutes and strain. 
Tea brewed that way tasted bland to me, barely any taste no matter what tea I used.

Then I discovered another way, it might seem odd, but it’s delivered the best tea I’ve ever had and made me abandon coffee. The recipe is as follows:

-Boil 1 liter of water (better the quality the better)
-Add 50-55g white sugar depending on taste, stir to combine (while boiling)
- as soon as the sugar dissolves remove from heat, add 11.5g of OP1 cylon black tea of your choice.
-cover and steep for 20-30 minutes, preferably covering the spout and kettle with an insulating cloth
-if it becomes cold, either strain and put back on the stove or put directly on the stove to heat it WITHOUT BOILING AGAIN.

This method IMO gives a balanced cup that actually tastes like something. With barely any bitterness.
Again this might sound odd at first, but I invite you to try it with black tea.

The steep time and amount differs depending on tea grade.",Jerrycanprofessional,https://www.reddit.com/r/tea/comments/18y5bh3/alternative_brewing_methods/
18xn83b,"We bought those 2 cakes in a recent trip, did we get ripped off?",11,8,,The first one is white tea from 2016. The second one is puer and the shop owner told me it was 5 years old. They were around $50 each.,InLoveWithInternet,https://www.reddit.com/gallery/18xn83b
18xfbzv,"Tea from Korea, Taiwan, Austria, Japan and Thailand. 😊",35,8,image,Random tea that I bought from the different countries that I visited. 😊,hideyhole9,https://i.redd.it/jgkvzxn117ac1.jpeg
18xqyvo,How do I drink this?,7,17,image,"Got this as a gift but all the instructions are in japanese, tried googling but I cant find much! I think I just pour it in but im not sure if its drank cold or hot…thanks!",obamas_llamas,https://i.redd.it/2vlsjfu4w9ac1.jpeg
18xxw0c,Water to Bag Ratio?,1,3,,"I've decided to pick up some herbal teas today, specially the Sleepytime tea from Celestial Seasonings. My mom made this one for me all the time when I was a kid, but I can never make it properly now. (22 years old and I can't make tea properly I know)

What is a good water to bag ratio along with steep times to avoid bland tea?",HexaberryTV,https://www.reddit.com/r/tea/comments/18xxw0c/water_to_bag_ratio/
18xnlg4,Sweet oolong tea,6,9,,"

I particularly enjoy teas with a sweet profile something reminiscent of honey, fruity notes, and a touch of vanilla.

I've read about bug-bitten oolong providing a natural sweetness, but I'm curious about non-bug-bitten options that can still deliver that delightful sweetness. What oolong teas do you suggest for someone with a preference for a sweet taste, excluding bug-bitten varieties?


Additionally, I’d love some advice on how to enhance the sweetness of my oolong. Should I adjust the brewing temperature or try any specific brewing techniques? Any tips on what I can do to keep my oolong tea consistently sweet would be greatly appreciated. Despite the general understanding that oolong isn’t inherently sweet, I’m on the lookout for teas that offer a naturally sweet profile—something reminiscent of honey, fruity notes, and a touch of vanilla.

While I’m aware that oolong is traditionally not considered a sweet tea, I assure you that I genuinely enjoy its complex flavors. 

Looking forward to hearing your thoughts.",CreditPsychological4,https://www.reddit.com/r/tea/comments/18xnlg4/sweet_oolong_tea/
18xk8kd,Simon Lévelt tea haul!,10,6,image,,TwistandShout19,https://i.redd.it/97tqxyoxf8ac1.jpeg
18xve8u,Herbal Shops?,2,5,,"Looking for recommendations on online places I could order individual ingredients. I like to make my own teas, but my local health food store is a bit limited in selection. I'm going to be attempting a dupe of Yogi Tea's Throat Comfort as that is my favorite, but I want to stop supporting the 3HO cult.",TheWalmartDrugCartel,https://www.reddit.com/r/tea/comments/18xve8u/herbal_shops/
18xs1uh,Lemon-iest herbal tea?,3,19,,"Lemon is my absolute favorite flavor and I'm seeking the most lemony herbal teas/tisanes (I already add lemon to regular tea lol.) I like Celestial Seasonings Lemon Zinger and it tastes great but I have to add lemon juice before I taste much lemon. Hoping other lemon flavor lovers have some suggestions, thanks! ",ouroborous3,https://www.reddit.com/r/tea/comments/18xs1uh/lemoniest_herbal_tea/
18x2eop,Local tea shops sell almost exclusively flavored teas,127,107,,"There aren’t many tea shops in my area of the midwestern US. One recently opened in my town and I dropped by today to check it out. Almost all of their teas had fruit and/or spices added. There were only a handful of pure teas, and I did buy some of them, but I was kind of disappointed by the selection.

There’s another shop in a nearby town, but from what I can tell from their website, it’s kind of the same deal. They have pictures of tea with colored sugar and all kinds of crap mixed in. Not at all what I’m after. I would have to drive an hour round trip to the closest tea shop that has a good variety of pure teas. Probably worth it for good quality tea, but I wouldn’t be able to go very often.

I’m just wondering if it’s normal for tea shops to focus so heavily on teas with added flavors? Is this the kind of tea that most customers prefer? I’ve just been buying my tea online, so this was my first visit to a tea shop. I’m just bummed because I finally have a shop nearby but it’s not really a place for tea purists. What are your local shops like?",ghostedmarshmallow,https://www.reddit.com/r/tea/comments/18x2eop/local_tea_shops_sell_almost_exclusively_flavored/
18xzmpc,Is it my teapot or me?,1,4,,"Hi I got a teapot from Amazon (im assuming) for Christmas and some things about it are getting on my nerves. It has a dribble and ive been trying to pour from different angles to see what works best but the damn lid leaks as well!!! I tried making a cord to help with tension for the lid, but god the fucker leaks just as much. It all ends with me whipping out 5 paper towels because of the mess it causes......any tips/ recommendations for a cheap and (most importantly) affordable teapot???????",Macromiic,https://www.reddit.com/r/tea/comments/18xzmpc/is_it_my_teapot_or_me/
18xzfrz,Kyusu,1,1,self,"I am looking for a vessel to brew small 1-2 cup portions of loose tea - I mostly drink tieguanyin, basic oolong, and recently gyokuro (which brews at much lower temps).
I was looking at kyusu to brew in, rather than the glass French Press or metal tea baskets I'm using today with imperfect results.
Would something like this vessel be appropriate given my tea selections? The size, style, and one-handed pour appeal to me. I'm no tea master so I'd like something that will work in most cases without needing other pots. 
https://www.sazentea.com/en/products/p1344-gyokko-yohen-sendan-kyusu.html",matthewf01,https://www.reddit.com/r/tea/comments/18xzfrz/kyusu/
18xjj6o,Non dairy milks for tea?,8,17,,Hi all. I tend to drink strong black breakfast teas in the morning with a little maple syrup and “barista blend” oat milk. I’m curious what other non dairy milks folks have liked with their tea and why you like them.,PassGreedy9142,https://www.reddit.com/r/tea/comments/18xjj6o/non_dairy_milks_for_tea/
18xyhzs,Who made this teapot?,1,3,image,,JMJimmy,https://i.redd.it/kq1opk11ebac1.jpeg
