id,title,score,num_comments,post_hint,self_text,author_name,url
199pmki,"What's in your cup? Daily discussion, questions and stories - January 18, 2024",5,18,,"What are you drinking today? What questions have been on your mind? Any stories to share? And don't worry, no one will make fun of you for what you drink or the questions you ask.

You can also talk about anything else on your mind, from your specific routine while making tea, or how you've been on an oolong kick lately. Feel free to link to pictures in here, as well. You can even talk about non-tea related topics; maybe you want advice on a guy/gal, or just to talk about life in general.",AutoModerator,https://www.reddit.com/r/tea/comments/199pmki/whats_in_your_cup_daily_discussion_questions_and/
1977mx8,"Marketing Monday! - January 15, 2024",3,13,,"We realize there are lots of people involved in the tea industry here, so this thread is a weekly feature where anyone can promote their current projects without worrying about the self-promotion rules.  Feel free to include links to your shop, crowdfunding sites, surveys, sales, or discount codes.  The rule against claims of health benefits remains in effect here.  It should go without saying that we still expect people to be respectful and follow the reddiquette.  While we intend for this to be a free-for-all promotion zone, please don't overrun the thread posting the same thing over and over.",AutoModerator,https://www.reddit.com/r/tea/comments/1977mx8/marketing_monday_january_15_2024/
19a7qmv,Chinese friend gave this as a gift. Can someone teach me how to use it? I don't really drink tea.,58,23,image,,-Herpderpwalrus-,https://i.redd.it/zoyodrws1bdc1.png
19adm92,Matcha ice cream!,17,2,image,"Matcha soft serve from Tea Master in Little Tokyo, Los Angeles! This place isn't Porto's level famous but I never been there without a long line. Don't see a lot of love for them here, maybe they're too local? They also sell matcha and Japanese teas inside too! Unlikely to happen but 10/10 would wait for them to open another shop in LA.",cathychiaolin,https://i.redd.it/bbmcrlzyncdc1.jpeg
19a96f2,2024-01-18 CC Fine Tea Phoenix Mountain Oolong (Dancong) first tasting notes,27,4,,See comment for notes (absolutely stellar Dancong).,DevOpsProDude,https://www.reddit.com/gallery/19a96f2
199zyrw,My tea’s shelf,56,9,image,,MaxBanera,https://i.redd.it/964kahbqd9dc1.jpeg
19a4wvt,A late afternoon cup of tea and the last of my Christmas biscuits.,27,3,image,,Chocko23,https://i.redd.it/868m49oeeadc1.jpeg
199x34r,Are there any teas (or types at least) that are inherently not meant to be gong fu brewed?,35,58,,,Tryaldar,https://www.reddit.com/r/tea/comments/199x34r/are_there_any_teas_or_types_at_least_that_are/
19a4ckh,Do you use a vessel for the hot water when doing gongfu?,8,23,,"Having the kettle by the side draws away from the nice aesthetic of the fancy teaware but also just a glass vessel full with clear water doesn't particularly appear to me either.

Any ideas or blunt pov of me being too awkward for my own good?",CasualNormalRedditor,https://www.reddit.com/r/tea/comments/19a4ckh/do_you_use_a_vessel_for_the_hot_water_when_doing/
19a66te,Recommendations for Jasmine Tea?,7,4,,"Hey all! I'm looking for recommendations for your favorite jasmine tea. I fell in love with this loose leaf jasmine tea that I was gifted in a sampler set (but the brand doesn't sell it on its own). I loved how fragrant it was - such a joy to drink. 

But then...

I bought a jasmine tea from a local Asian grocery store and absolutely hated it. It was grassy and bitter.    

I'm hoping to find a light and fragranct jasmine. Appreciate any recommendations!

Happy sipping!",Dizzy-Cranberry-2319,https://www.reddit.com/r/tea/comments/19a66te/recommendations_for_jasmine_tea/
199sgna,How do you research vendors before buying new tea?,32,35,,"I've subbed for a long time, but my interest in tea waxes and wanes. As someone not steeped in the culture all the time, it feels impossible to know where to buy tea from.

I do see a ton of recs to look at the sidebar vendor list. That list has 261 vendors on it, and it includes places like Jesse's Teahouse, which I frequently see called out here as a grift.

I have no idea how to narrow down the list of vendors to ones that are actually respected.

I got Adagio off that list, then I saw it described as ""fine for beginners"" the other day. Yunaan Sourcing comes up a lot, but I saw the exact same criticism there and also that ""obviously you shouldn't get oolong there"". But I had no idea.

So how do YOU research vendors? How do you vet on the front end that someone is going to send you quality tea?

*(Personally, I'm looking for samplers of white tea and oolong tea, but I'm more interested in learning how you all vet vendors, so that I can do it for myself)*",YourFriendNoo,https://www.reddit.com/r/tea/comments/199sgna/how_do_you_research_vendors_before_buying_new_tea/
199vnrw,What should Assam tea taste like?,16,7,,"I mostly drink Chinese black tea from Yunnan. The flavor is often malty, deep, dark berry-like and very smooth. Since I've been inspired by HK milk tea recently (I'm aware they use a mix of Ceylon and a special brewing process), I wanted the richest and maltiest possible tea, to maybe experiment with milk since I've never had milk tea before. So I bought two types of Assam tea. To be fair, I didn't research much about Assam's renowned estates, gradings etc. The gradings are STGFOP1 and SF FTGFOP1.

Even without adding milk, there's not really a discernible taste other than a sharp astringency. To be honest, it tastes exactly like a Twinings tea bag; thin and bitter. The opposite of malty and rich. Brewing for a few minutes in a \~200ml pot or \~120ml gaiwan. A lot of leaves.

Obviously, I can't generalize an entire tea type based on randomly trying only two of them, so did I just choose bad tea? Or does Assam tea generally taste like this and I'm looking the wrong way?",Professional-Fan1372,https://www.reddit.com/r/tea/comments/199vnrw/what_should_assam_tea_taste_like/
199kfic,"Am I crazy? Every time partner makes a cuppa, it tastes soapy?",100,61,,"I feel like I’m crazy, but this happens so often. Every time I make a tea, it’s absolutely fine, then there’s a nice hot tea waiting for me at home from my love, but it tastes like a dirty dish rag? 

I always make sure the tap runs cold before I fill the kettle but I have caught my partner using hot water “so it boils faster” but the water is murky. Is this probably the reason for the taste discrepancy? 

Trying to think what else it could be? Just had to throwaway a giant mug full, rip.",deiac,https://www.reddit.com/r/tea/comments/199kfic/am_i_crazy_every_time_partner_makes_a_cuppa_it/
199994e,Today’s Tea: White Tea with its flowers. Grown in Southern Appalachia USA.,294,42,,"I harvested the leaves in 2021 and the flowers in fall 2023. This was one of the most delicious cups of tea that I’ve ever had. Very sweet and floral, no bitterness at all.",A-ViSiT0R-,https://www.reddit.com/gallery/199994e
199gnp4,"Koicha matcha I had at Ippodo tea in Kyoto, Japan",105,19,image,,MattJak,https://i.redd.it/gz8ef7v3e4dc1.jpeg
19a1i99,What is the history of the word Chai versus Tea,3,7,,"Hi all, I have noticed that Chai and Tea seem to be used interchangeably depending on the country I am in. I vaguely know that this has something to do with trade routes, but I was hoping someone with a deeper knowledge on the topic could explain this to me.",davinamaraclaire,https://www.reddit.com/r/tea/comments/19a1i99/what_is_the_history_of_the_word_chai_versus_tea/
19a9f9h,Info: high tea ≠ afternoon tea,2,2,,"‘High tea’ is often used interchangeably with ‘afternoon tea,’ but high tea is an evening meal with bread, veg, meat and a cup of tea. People from my home area, where high tea originated, still use the phrase ‘tea’ to mean dinner. 

Takes me a minute to realise I’m not being invited for a 7pm ‘tea’ but afternoon tea and cake instead. These are still two different events for some dialects and it would be great if the original meaning of ‘afternoon tea’ was adhered to.",GiseleGiseleM,https://www.reddit.com/r/tea/comments/19a9f9h/info_high_tea_afternoon_tea/
199xi7d,Want to Delve into Chinese Black and Green Teas,4,11,,"Hello! I am not a tea newbie, but my tea experience is limited to English-style brewing of Indian and English black teas and flavored green teas. But in learning so much on this sub, I’d like to start delving into some of the more popular classic Chinese teas that I’ve seen discussed by tea purists here.  

Can anyone kindly recommend a few \*entry-level\* types of pure Chinese black and green teas that are not too expensive and reasonably prevalent to buy in the US?  I'm looking for non-esoteric choices that are a good starting point for burgeoning tea purist. Thank you!

UPDATE: thanks to everyone for the suggestions.  I’m excited to get started. ",cursedandblessed1,https://www.reddit.com/r/tea/comments/199xi7d/want_to_delve_into_chinese_black_and_green_teas/
19a7zxx,How long to brew Longjing gongfu-style?,0,2,,"I know grandpa style is recommended, but I like the ceremony and together-ness involved in brewing gong fu for a group.

What's the recommended infusion time? Does it need a wash?

I generally see consensus online on 3g per 100-150mL, but there's wide variance in infusion time... I've seen guides say 15s and others say that green teas need longer times, e.g. more than a minute.

Anyone have advice for a first time Longjing brewer? Thank you!",wardellinthehouse,https://www.reddit.com/r/tea/comments/19a7zxx/how_long_to_brew_longjing_gongfustyle/
19a7n8r,Why does my matcha tastes so bitter? I wanted to try matcha tea and i went to the trouble of buying from abroad because in my country there is no hope of finding any good matcha and i saw this chart. So i trusted i would drink a good quality matcha w,1,0,image,,xoxIsabellaxx6,https://i.redd.it/3gi20qiz0bdc1.png
19a77bo,Best cheap bulk cold brew tea in the UK,1,0,,Thinking of getting something from Yunnan Sourcing but I have no idea what would be best!,Christian159260,https://www.reddit.com/r/tea/comments/19a77bo/best_cheap_bulk_cold_brew_tea_in_the_uk/
199ng75,Judging Matcha By Color,13,6,image,"Judging matcha by color! Here's how.

Good matcha = bright green, like spring grass after rain. Think vibrant, almost electric green. This kind of green tells you the leaves were shaded just right and picked young, making it sweet and smooth.

Bad matcha = dull green, like old moss. Brown or yellow tinges are even worse. These colors mean the leaves were old or not shaded, so the matcha will be bitter and kinda bleh~ (vomit)

Think of it like traffic lights:

Bright green = GO! Grab this matcha, it's gonna be delicious.

Dull green = CAUTION. Maybe okay for baking, but not for sipping.

Brown or yellow = STOP! Run away, this matcha needs to go in the bin, not a cup.

Bonus tip: The deeper the green, the fancier the matcha. Think emerald jewels, not pea soup.

Remember, color isn't everything, but it's a great first impression. So next time you're choosing matcha, give it a good glance before you take the plunge.

Online Shopping?

Shopping for matcha online is tough! You can't see it for yourself, unlike in a store. That makes it hard to know if it's the right color.

Even photos are tricky. Phones and cameras can mess up the true color of things. This picture I took? Phone camera, no flash because it made it look yellow. I had to play with the brightness, colors, and light settings on my phone to get it closer to the real thing. Fancy editing software? Nope, just phone tricks. I got it mostly right, but not perfect.

Judging matcha by color? In person, it's a good way to go, but not totally reliable. Videos and pictures? Forget it!

The best way? Samples! Ask sellers for tiny amounts to try before you buy. That way, you can taste and see for yourself if it's the matcha you're looking for.

Happy judging!",ujihatea,https://i.redd.it/cj1pm0w5i6dc1.jpeg
199qwgg,Gyokuro at Gion Tsujiri and Uji Fukujuen,8,2,,"Many moons ago, Gion Tsujiri used to offer this beautiful tea set on their menu. They actually had English instructions but maybe because I tried to act snobbish and ordered with my less than toddler level Japanese so the bad karma reward me with this Japanese instruction leaflet I have no clue how to read and yes they left me alone to brew this Gyokuro which I barely have idea of the perfect brewing.

Anyhow, after struggled with the whole ordeal. I managed to ""wing"" ahem ( read ""brew"") myself a cup of not too bad Gyokuro.


I think I don't have that gene for umami sweetness. I only taste like umami type saltiness. It was a fun experience though.

Next one was at Fukujuen, I think they came with English leaflet, and again you brew your own Gyokuro.

I can't really tell the differences though from these two places. 

BUT

Fukujuen let you eat the tea leaves afterwards. So you dip in ponzu/ yuzu ponzu sauce to eat the precious leaves!

I don't know if they still do it now but it is also a worthy experience for tea enthusiasts.

Also if you happen to visit Kyoto..



There was a well called ""three Kyoto famous water"" in well water/spring water with such a lot of Kyoto.
･Somei
･Samegai
･Agatai

Somei is still in use, and you gotta try brew your tea with that water and bring the water back home. My friend tried it and mentioned that it makes tea taste really better!",WillAlwaysNerd,https://www.reddit.com/gallery/199qwgg
199okvo,"Water Comparison on Green tea: Brita Jug water vs Clean, but very hard Swiss tap water. Brita loses",11,27,,"TLDR: Not all hard water seems to profit from a Brita jug. For some, I think it has quite a detrimental effect.

Title is a bit misleading, it's not that hard at 100mg/l calcium.

I heard from multiple sources, that filtering water with a brita jug is a no brainer if you got hard water or any other issues with water.

I just tried it in the context of hard, but clean water and can't recommend the brita jug at all. Interestingly, the taste seems flatter, unpleasantly sweet and just a bit rounder.

\- Water: put to boil. Very drinkable Swiss tap water with \~100mg/l calcium. Two steps to reduce scale: 1. Multiple Scale catchers(looks like steel wool) in the kettle 2. Giving it a short rest, such that the small scale particles flow to the bottom. I throw the bottom 20% of the water away. Looks very milky, so seems a lot of minerals are in there.

\- Tea: Taiwanese Bi Luo chun. Very light, floral tea with an Oolong note, that was particularly muted by the Brita.

Especially during later brews, the Brita tea lacked deeper notes, complexity and florality. The tap water did have a bit of an aggressive mineral note, but it was overall better.

Disclaimer: This was according to my expectations, hence there might be bias involved. A local tea seller made similar experiences and told me prior. Also I am very used to drink tea made from this water.

Somebody has experience and thoughts about this scenario?

Maybe I need to do a blind taste...

EDIT: Just did the same with young punchy sheng and it's the same song and dance.",chiubicheib,https://www.reddit.com/r/tea/comments/199okvo/water_comparison_on_green_tea_brita_jug_water_vs/
19a5ljf,I’m tried of tea bags but I’m in college,0,12,,"I’m tired of tea bags, I’m in college and want to brew lose leaf but I live in a dorm room it a single. Should I go with Gongfu style or western styles brewing.",finn1027,https://www.reddit.com/r/tea/comments/19a5ljf/im_tried_of_tea_bags_but_im_in_college/
199ug2m,Harney and Sons Cherry Blossom + Numi Jasmine Green,4,1,,"So I combined these two green teas cause they're more ""aromatic"" sweet than dessert sweet which I prefer, and they are ✨️amazing✨️ together. Kinda tastes...nostagically kawaii? Like, I sip it and I'm transported back to playing my Hello Kitty games on the box computer in the early 2000s. But it's very nice and sweet; would make a good boba milk tea. Nice cherry, vanilla and floral notes.",PracticeJealous193,https://www.reddit.com/r/tea/comments/199ug2m/harney_and_sons_cherry_blossom_numi_jasmine_green/
199gz4h,First experience with loose leaf - YS order finally arrived!,38,10,,"Shipment arrived a week late after USPS deciding to ship it back and forth across the country a second time just for funsies. Very happy with this one, bad at describing tea but this Ai Lao mountain black tea is so incredibly fragrant and floral on the nose it made me smile. And i didn’t spill with the gaiwan yet hahaha. Good first experience all around!",duvangrgataonea,https://www.reddit.com/gallery/199gz4h
199bxvs,Airport tea - someone who serves milk on the side 👍🏻👍🏻,58,13,image,"They usually put the teabag and milk in together = doesn't brew well..
For $6 AUD I hope it tastes ok.",Faaarkme,https://i.redd.it/yasuaolba3dc1.jpeg
19a2dtn,Tins Worth Keeping,1,1,,"OK tea you're willing to shell out for because the tin is so attractive? Also best worth-it, fancy-pants tea in best tin? Looking to branch out from Mariage Fréres, Taylors of Harrogate, Fortnum & Mason, Harney & Sons, Makaibari, and New English. What am I missing? (Extra points for tea on the Typhoo/PG Tips spectrum.) Thanks!",MarzipanPiglet,https://www.reddit.com/r/tea/comments/19a2dtn/tins_worth_keeping/
19a1r96,Vahdam Tea out of stock/ discontinued,0,3,,"I visited the Vahdam Tea website today to make a tea order and am concerned. Does anybody know why Vahdam is out of so many teas? I’m worried they are going out of business or something. I can’t find ginger chai loose leaf anymore and turmeric spiced loose leaf. I have been buying from them for years but have never seen their selection so bad. 
Many they used to offer are not listed anymore.
Their website was also super glitchy so I paid with PayPal not trusting to put my card. And I couldn’t login. 
I noticed there are some being sold on Amazon for double price. 

Thanks",Wooden-Tie-5533,https://www.reddit.com/r/tea/comments/19a1r96/vahdam_tea_out_of_stock_discontinued/
199sl0y,Ten FU’s Teas,3,9,,"Does anyone have experience with ten FU’s?  I am somewhat new to premium teas and I am looking for a source for Chinese teas of good to excellent quality tea. I am somewhat new to premium tees, and I am looking for a source for Chinese teas of significant quality.",Smoresbuddy,https://www.reddit.com/r/tea/comments/199sl0y/ten_fus_teas/
198vvi8,"After all the discussion about snobbery, we should take some time to enjoy tea the way it's meant to be brewed.",397,44,image,,chiubicheib,https://i.redd.it/20ql20qqyzcc1.jpeg
199narw,Matcha's Color,9,2,image,,ujihatea,https://i.redd.it/rgc9qk7fg6dc1.jpeg
199vcrv,Looking for milk oolong,2,4,,"Like it says on the tin! I used to buy loose leaf milk oolong from Republic of Tea years ago, and it was my favorite. I dropped out of the tea scene for a while, and now I'm getting back into it, I find RoT doesn't carry milk oolong anymore! Anyone know any reputable vendors that don't break the bank?",isopodpod,https://www.reddit.com/r/tea/comments/199vcrv/looking_for_milk_oolong/
199r6wz,"silver needle white tea, how much “needles” should I do in one cup?",3,6,,"Hi, I bought silver needle white tea and I am wondering how much “needles” should I do in one cup? It’s hard to measure in teaspoons. 

Now I’ve put 10 in one cup and with 70 degrees water, but I taste mostly the water. 

Thank you",PerceptionFickle8383,https://www.reddit.com/r/tea/comments/199r6wz/silver_needle_white_tea_how_much_needles_should_i/
199dzu8,Why does this say herbal tea?,32,33,image,"I was under the impression that herbal tea didn’t come from the same plant that produces black/green tea, but instead came from… well herbs",Other-Ad-5236,https://i.redd.it/1osau55zq3dc1.jpeg
199ss2y,Individually wrapped sachets?,2,5,,"Hi all! I recently started having to work in the office two days a week but we no longer have dedicated desks or lockers or any way to keep anything at the office. I’ve adjusted my tea brewing to match this and have been using pyramid sachets in a keep cup, which is working well enough.

I am hoping to expand my tea options, though, and am wondering what companies do individually wrapped sachets, like the ones from Harney & Sons gift boxes? I know Teapigs and Big Heart Tea Co do sachets but they don’t appear to do individually wrapped ones, even online. I’ve just been tossing them in sandwich bags and inside a larger bag but it’s kind of chaotic and messy for teas with fine particles (like Cup of Sunshine.) 

Happy to order online or purchase in gift set format if needed. 

Any ideas?",sunlightandair,https://www.reddit.com/r/tea/comments/199ss2y/individually_wrapped_sachets/
199xyck,Experience or info on the Senbird TETSUBIN GEN and KIYOSHI Luxury Tetsubin teapots?,1,4,self,"I have been looking a new teapots and am curious about Tetsubin cast iron teapots. On the higher end  teapot listed below, people say it gives the tea a better taste, and am curious if folks have experience with that and that particular teapot.

I am concerned about anything made in china, and particularly concerned with enamel/ceramic coating because when put on cookingware using new nanotechnology methods for adhesion, titanium nanopartiles have been shown by peer-reviewed journal articles to leach into our food. It could be a minor issue if the qualities are low enough, but so far I see far too little research into its safety for comfort.

(On a side note, I think ceramic pottery (cups, plates) are fine. That probably goes for most pure ceramic tea pots too.)

Even though this [KIYOSHI Luxury](https://www.amazon.com/stores/KIYOSHILuxury/page/171C7543-ED02-46E6-9404-49C5CA92B681?ref_=ast_bln)[ Tetsubin](https://www.amazon.com/KIYOSHI-Luxury-Japanese-Stovetop-Interior/dp/B08HSDHBM4/?_encoding=UTF8&pd_rd_w=RWrG0&content-id=amzn1.sym.35cab78c-35e3-4fc1-aab0-27eaa6c86063%3Aamzn1.symc.e5c80209-769f-4ade-a325-2eaec14b8e0e&pf_rd_p=35cab78c-35e3-4fc1-aab0-27eaa6c86063&pf_rd_r=XY7D59S7JVQ1BGMPTZGK&pd_rd_wg=098S1&pd_rd_r=e8f8dc28-1655-4749-8313-887a89042f71&ref_=pd_gw_ci_mcx_mr_hp_atf_m&th=1) tea pot is suppose to be handmade, I have my doubts due to the price, and the lack of info about the brand off of Amazon. Thus, I do not trust its enamel interior unless anyone has compelling evidence to the contrary.

On the opposite end of the spectrum [Senbird TETSUBIN GEN teapot](https://senbirdtea.com/products/tetsubin-cast-iron-kettle-teapot-gen) is $250. They do have a website on which they detail some of their production process and they claim to use methods 900 years old. I still can't be 100% certain but given their price point and website, I would trust their enamel interior is made without nanotech. However, I find very little in terms of outside reviews on this $250 product, which is concerning since I would hope it would be good enough quality to last a lifetime and be passed down as a heirloom. The 2 reviews on the Senbird website both mention that the teapot does make the tea taste superior due to the minerals released into the tea.",WaterCello,https://www.reddit.com/r/tea/comments/199xyck/experience_or_info_on_the_senbird_tetsubin_gen/
199psdo,"Hello, need help with a birthday gift for my girlfriend",3,9,,"My girlfriend has gotten into this tea hobby thing that you guys are into, she is really into the Chinese tea tradition with the whole ceremony. I believe she has a proper teapot, a little shelf for the her tea pet. But I don't think she has a lot of different types of tea to try out and i'm not sure if she has quality cups for it. So what do you guys recommend.

I want to buy something so she can try out a lot of different types of tea like a giftbox or something. (She is fan of more bitter tasting tea, but likes to try out a lot of different types of stuff). And a set of proper cups. Maybe a thermometer as well. I have no idea where to buy that stuff though or what is good quality.

My budget is 80 Euros, I live in the Netherlands. So i'd be nice if it's available there.",whathehellnowayeayea,https://www.reddit.com/r/tea/comments/199psdo/hello_need_help_with_a_birthday_gift_for_my/
199je11,2024-01-17 Puerh Junky ‘13 Double Happiness XG Raw Puerh (sheng) tea first tasting notes,10,2,,See comment for notes (very enjoyable full bodied fruit finish aged puerh).,DevOpsProDude,https://www.reddit.com/gallery/199je11
199rshg,Getting rid of the persistent plastic smell and taste in tea kettle?,2,4,self,"My favorite tea kettle suddenly went bust and I had to replace it with a [Hamilton Beach electric tea kettle](https://www.bestbuy.com/site/hamilton-beach-1-7l-electric-kettle-stainless-steel/6169104.p?skuId=6169104). I've boiled and dumped water from it around 15 times already and can't get rid of the plastic smell or the taste in the water. The smell is coming from the lid and the filter at the spout (pictured above). The water obviously doesn't touch either when the kettle is filled and boiling so I don't know how it's supposed to get the smell out like the instruction claim. Can anyone provide any advice about how to get rid of the smell and taste?

https://preview.redd.it/7l72vugkj4dc1.jpg?width=1343&format=pjpg&auto=webp&s=4a30039516a03aa679945dc731a2dff45289528d

https://preview.redd.it/uytj5vgkj4dc1.jpg?width=2570&format=pjpg&auto=webp&s=d0a9044f21707919267a1e752285781f64898777

&#x200B;

&#x200B;

(Yes, I know a stovetop tea kettle is better. I wish I could have one, but this electric tea kettle is my only option right now for reasons)",readyforabadpoem,https://www.reddit.com/r/tea/comments/199rshg/getting_rid_of_the_persistent_plastic_smell_and/
