id,title,score,num_comments,post_hint,self_text,author_name,url
1971dp8,Tea set brands,1,0,,Was wondering for china(not the country) tea set brands that look nice that are affordable.,RedMadTyrant,https://www.reddit.com/r/tea/comments/1971dp8/tea_set_brands/
196lezi,I like to drink this in the morning. Anyone else like this one?,10,3,image,,SignorAlighieri,https://i.redd.it/fqrgjekpzfcc1.jpeg
196nb7w,Is this good tea?,8,21,image,My father bought me this tea and curious about the quality.,twiggs462,https://i.redd.it/6h6sdlcgegcc1.jpeg
19712em,Do you guys do anything with your tea leaves after a brew?,1,0,,"Maybe silly question. Maybe not. Maybe you turn them into mulch. Maybe you toss them in the garbage. What do I know? Do any of you do anything with them?

 Depending on the tea and where I’m at in my hair wash cycle, I’ll use the second brew and make a water that I soak my hair in to detoxify my hair then do a shower. I’ve also used already steeped (warm but not hot) tea and placed in mesh to place over my eyes to reduce bags or puffiness. I’ve also taken already steeped leaves and overnight steep them in the mix I use to make ice cream. Then I strain and make ice cream next day for tea flavored. Works great with earl grey or stronger green teas, for example.",Vodkadonuts,https://www.reddit.com/r/tea/comments/19712em/do_you_guys_do_anything_with_your_tea_leaves/
1970win,"Yerba mate cups &straws (""cool"")",0,1,,"Yall got cool yerba mate cups or straws? What other leaves can I brew in the mate gourds?

I brewed powdered rosemary on the stovetop and the water turned purple. Does finely grounding leaves make water more potent?",123pala,https://www.reddit.com/r/tea/comments/1970win/yerba_mate_cups_straws_cool/
196w6qi,Trying to get in to tea- help?,3,11,,I love black coffee and want to get in to tea. Any suggestions on what to try?,TonyBeverage333,https://www.reddit.com/r/tea/comments/196w6qi/trying_to_get_in_to_tea_help/
195xnl9,The amount of disrespect…,385,380,,"I’m debating leaving this sub again because I cannot deal with the amount of people on here that think they’re so much better than everyone else because they only drink the finest, freshest, most expensive tea. Someone will post something that shows bagged tea and someone will ALWAYS be passive aggressive in the comments. You’re not better than someone just because you drink higher quality tea. Not everyone is interested in drinking that, either. You are no better than anyone else so please be respectful.

Edit: This was not an uncharitable post, I tried to voice my concern in a genuine way without being rude. I was in no way trying to “drive tea enthusiasts away” from this sub…? All I was doing was bringing light to something I’ve seen around here, regardless of if it’s genuinely trying to be given as advice or not. Some people brought up a good point that “tea” can be taken as a hobby or simply as a drink, and when you mix those two groups of people, chaos can happen…as shown in these comments, lol. Again, I wasn’t trying to be uncharitable with this post, yet many of you here were being uncharitable to me. I guess that’s the internet for you, lol!

Edit 2: Reading comprehension: I’m not saying that tea enthusiasts shouldn’t be allowed on THEIR OWN SUB, go ahead and be obsessed and nerdy about tea! You can do that on this sub! I’m not talking about people who like to be snobby with their tea, I’m talking about people who USE THAT SNOBBINESS to be RUDE TO OTHERS.",Sufficient_Pay_820,https://www.reddit.com/r/tea/comments/195xnl9/the_amount_of_disrespect/
1969m1t,What’s something you learned throughout your journey to loving tea that you wish you’d started doing sooner?,58,55,,"Recently getting into tea. Something I’ve gone in and out of, but always returned to in my life. One thing I wish I’d realized earlier is that the temperature of the water seriously, seriously impacts flavor. Yes, it’s something that’s kind of general knowledge (I think) but many years I just kind of figured couldn’t be that big a change. I was wrong.",Vodkadonuts,https://www.reddit.com/r/tea/comments/1969m1t/whats_something_you_learned_throughout_your/
196lben,What's this tea?,7,3,,,thebeaverbutter,https://www.reddit.com/gallery/196lben
196nd2k,Can Anyone Identify this Tea,6,1,image,"I received it as a gift. It came in a lovely black tin box. 

Before trying, I was hoping to know what it is.",lipecker,https://i.redd.it/jtk0yq9tegcc1.jpeg
196kop3,First cup of Bi Luo Chun tea,6,24,,"As a follow up to a previous post in which I asked for tea recommendations for a black tea that was full-bodied with caramel notes, someone had commented about Yunnan Bi Luo Chun. I just had my first cup of Yunnan “Black Gold Bi Luo Chun” black tea and it was incredible. 

Next cup is Middle Mountain “Orange Blossom Aroma” Dan Cong Oolong. ",RUMyMuse,https://www.reddit.com/r/tea/comments/196kop3/first_cup_of_bi_luo_chun_tea/
196tvp2,Food pairing and true teas.,2,4,,,Saoirse1312,/r/foodtheory/comments/196tvby/food_pairing_and_true_teas/
196pi5j,Double milk oolong suggestions?,3,4,,"Heya! So I’ve come to a rather delayed but tragic realisation that my fav oolong from Republic of Tea seems to have been discontinued! Absolutely tragic turn of events. There seems to be a good handful of alternative brands available for a double milk oolong/milky oolong, but I was hoping to get some feedback from anyone as to what brands would be preferred/best to go with, should anyone have any experience w/ this kind of tea or otherwise!! 

Thanks everyone! Cheers and best wishes—",Kurochat,https://www.reddit.com/r/tea/comments/196pi5j/double_milk_oolong_suggestions/
196xbgq,Shops with fast international shipping. NZ,2,3,,"Hey, surprised to find that of the tea and equipment I ordered last year only the stuff from aliexpress has arrived already (a teapot and gooseneck kettle).

Orders from mountain stream tea and yunnan sourcing still seem to be at least a couple of weeks away, are there any recommended vendors that you've had slightly faster shipping experiences with?",patrickhughes96,https://www.reddit.com/r/tea/comments/196xbgq/shops_with_fast_international_shipping_nz/
196rrzs,How do you like to prepare vegan masala chai at home?Ingredients & method please,2,10,image,"This is an oat milk masala chai from a coffee shop that I loved. At home, I use ‘Tea India Masala Chai’ (blend of black tea, cinnamon, ginger, cloves and anise) teabags. I’m pretty sure I need to switch to loose tea and heat it inside the milk but I’m not sure which UK-available brands to try & what method to get this smooth microfoam chai. Thank you so much.",goddesstheriver,https://i.redd.it/mcszws4pbhcc1.jpeg
196f1eu,"ITea World Dan Cong and Tie Guan Yin oolongs, review of the next set",10,0,self,"I reviewed ITea World oolongs and mentioned that here when it all became tiresome last year, and I'm at it again.  This next set's versions are slightly better; that's the short version of the whole story.

I reviewed a Dan Cong and Tie Guan Yin in a blog post in some detail, identifying which aspects were most positive (flavor), and which represent limitations (thickness of feel and aftertaste duration, with room for improvement of complexity and intensity).  This works as a summary of how quality levels tend to work out for upper medium and higher quality oolongs in general, and covers a general cost range for different versions from different types of sources.

Related to only hearing about these teas it wouldn't be worth it if someone had closely followed the last round; they're just a little better.

 [https://teaintheancientworld.blogspot.com/2024/01/itea-world-dan-cong-and-tie-guan-yin.html](https://teaintheancientworld.blogspot.com/2024/01/itea-world-dan-cong-and-tie-guan-yin.html)

&#x200B;

https://preview.redd.it/a6xqmsm3iecc1.jpg?width=1127&format=pjpg&auto=webp&s=c4dfdca0ec67578084debd26e6b5e7bd83899565",john-bkk,https://www.reddit.com/r/tea/comments/196f1eu/itea_world_dan_cong_and_tie_guan_yin_oolongs/
196hw4b,Should we all go in together on buying this Minneapolis tea shop?,6,8,image,"I think one of you should buy this… or let’s all go in together on it! It’s in Minnesota. Northern Tea Company is the name. 

Https://www.bizbuysell.com/Business-Opportunity/Well-established-tea-shop-incl-e-commerce-now-on-new-platform/2114653/",YesMoreTea,https://i.redd.it/0oqqufjg8fcc1.jpeg
1963ec9,Cooking with tea,72,21,image,Made a seafood pancake with amberjack and gyokuro.,day_break,https://i.redd.it/m0kuoom32bcc1.jpeg
196kqfq,Anybody remember the Indian college canteen cook’s recipe of tea mentioned on Quora long back,3,0,,"I am hunting for a Quora answer from a long time ago (2016 or earlier). The guy mentioned a tea recipe from hi college days. Probably of the college canteen’s cook’s recipe. He used to check whether the amount of sugar in the tea (chai) was perfect or not by lighting a match over the steaming still cooking chai. Something like if the matchstick went out at the count of 3, the chai was perfect and ready. Else needed more sugar. Similar steps for milk too.
I am unable to find that answer. Anybody else on this sub read that answer and can share the full recipe or a link to that answer ? Definitely an Indian guy studying in an Indian college.",Commercial_Home_2255,https://www.reddit.com/r/tea/comments/196kqfq/anybody_remember_the_indian_college_canteen_cooks/
196svid,Best Sencha for price?,1,3,,Anyone know a site to get a good amount of green tea for a decent price?,mrcrist2526,https://www.reddit.com/r/tea/comments/196svid/best_sencha_for_price/
196fdz8,"What's in your cup? Daily discussion, questions and stories - January 14, 2024",5,21,,"What are you drinking today? What questions have been on your mind? Any stories to share? And don't worry, no one will make fun of you for what you drink or the questions you ask.

You can also talk about anything else on your mind, from your specific routine while making tea, or how you've been on an oolong kick lately. Feel free to link to pictures in here, as well. You can even talk about non-tea related topics; maybe you want advice on a guy/gal, or just to talk about life in general.",AutoModerator,https://www.reddit.com/r/tea/comments/196fdz8/whats_in_your_cup_daily_discussion_questions_and/
196k496,foil packets vs none for bagged tea,4,8,,"Yeah, I drink a lot of bagged tea although I have a lot of loose stuff as well. Why? It's convenient. I plop a bag in the cup, push the button on my Zojirushi hot water pot, and bam...

My question is about bag packets. I recently got some EB style teas and they came without individual sealed packets. Just loose bags. How important is getting tea bags in individually sealed packets vs non? How fast do unpacketed tea bags get stale just sitting in a basket in the kitchen?

I go through about 6 bags a day so they don't sit too long.....",apk71,https://www.reddit.com/r/tea/comments/196k496/foil_packets_vs_none_for_bagged_tea/
196a1zf,Tea haul 🙂,16,4,image,"Stopped in to one of my favorite tea houses (Far Leaves tea in Berkeley California) for the first time in wayyy too long so I had to grab a few teas🙂.

The lavender white is one of my all time favorite teas. 

The Berkeley (herbal) blend is pleasant but I probably won't get it again.

The Puer, really pleasant, tastes like a puer but with a light roasty-ness, my tastes tends towards greens and whites so this works for me.

That's the puer in the cup.

Puers in general are kind of a miracle tea for me, I have shift worker sleep disorder and on my days off I often struggle to wake up before the sun sets, but everyday after I drink puer I manage to wake up closer to when I want to, I don't know how common this effect is but for me it's both consistent and often the only thing that works, so I've really come to love puer",overthinking-1,https://i.redd.it/dvpb5gj1vccc1.jpeg
196r1cn,What chai does Paris Baguette and French Workshop use?,1,0,,"I know that Paris Baguette uses a powder but im not sure which one, and I have no idea if French workshop uses concentrate or powder",YesterdayBusiness728,https://www.reddit.com/r/tea/comments/196r1cn/what_chai_does_paris_baguette_and_french_workshop/
1963hik,Traditional Dong Ding Oolong Tea from Taiwan,40,12,image,,Eco-Cha,https://i.redd.it/8qovt48q2bcc1.jpeg
1961f4l,"2004 Xiaguan ""Special Grade""",43,12,image,,DaKimchumPRO,https://i.redd.it/s1fnfckclacc1.jpeg
195xdxr,Snowed in with some cozy puerh,70,10,,,Kitchen_Film1904,https://www.reddit.com/gallery/195xdxr
195tccp,Same tea but different colors and flavors,119,23,image,"Same tea, different colors and flavors. Did the ingredients change or something? 

The tea from an older box on the right is pinkish and tastes good but the newer tea I just bought is brown and doesn't have any berry flavor, tastes horrible. Anyone else noticed?",Plenty-Particular304,https://i.redd.it/kyi688z5u8cc1.jpeg
196iuzd,Tazo Awake English Breakfast Loose Leaf alternative,2,3,,"Hello Tea drinkers, please feel free to roast me for this, but I will explain what I like and you can maybe point me in the direction of a loose leaf to try.

I drink iced tea every morning, the way I make it is with a 1.5 liter French press. Water to 200 degrees. I put 5-6 bags of tazo Awake organic English breakfast in, leave it on the counter (with the bags in) for 30 minutes. Then I put it in the fridge overnight (leaving the bags in) and pour over ice in an insulated mug the next day.

I love the bitterness and I'm guessing high tannins (maybe?) flavor of it. This is enough for 1.5 days, and it's a bit of costly ritual.

I've tried a few random English breakfast loose leaf teas on Amazon, and they taste like Lipton and instead of getting a rich bitter flowery flavor, kind of taste chalky the next day.

Could anyone help to describe what kind of monster I am, and what I should be looking for in a tea if this is how I enjoy it? 

I looked for 1:1 replicas of tazo Awake and couldn't find it. If that exists in loose leaf, I would happily go that route.

My hope is that someone here knows what type of flavor I love and is going to point me in the correct direction of an improvement.

Thank you friends",TechInTheField,https://www.reddit.com/r/tea/comments/196iuzd/tazo_awake_english_breakfast_loose_leaf/
196nqab,I've had apple cinnamon tea before just fine until,1,5,,"Recently when I tried Twinnings Apple Cinammon tea.   The first night I didn't think it was the tea, maybe dinner. But tonight I had a little bit about an hour and a half after dinner and then my stomach started hurting. I started feeling nausea and even threw up a little. A feel a little better after but I'm so confused.

I love the Celestele apple cinnamon tea and drink it frequently. Why is this one making me sick? 

Has anyone else had something weird like this happen to you?",BunnyGirlDotty,https://www.reddit.com/r/tea/comments/196nqab/ive_had_apple_cinnamon_tea_before_just_fine_until/
1973owq,Have you ever seen this girl doing the gongfu?,0,0,self,I’m learning so much about Chinese tea culture with her. https://www.tiktok.com/t/ZT8bQpxUX/,dragonleaf23,https://www.reddit.com/r/tea/comments/1973owq/have_you_ever_seen_this_girl_doing_the_gongfu/
195qmsj,Oh my! Cast your eyes on this beauty,155,11,,"Found this exquisite teapot in Morocco and the shop owner wanted 8,000 MAD (€734) for it. It’s 350g of silver and antique. But it still seems wayyyy overpriced. Does anyone know how much something like this is usually worth? It has an 800 mark on the bottom.",BelPea,https://www.reddit.com/gallery/195qmsj
196guef,Has anyone else tasted assam tea leaves from top creamery?,2,4,,"I think they weren't met for consumption by cup. I think they were made for bubble tea companies and apparently you're supposed to brew then in large batches and steep for 15 minutes.  


Which is not the usual way to brew tea from what I have read online. Did I buy wrong tea leaves?",mintyZer0,https://www.reddit.com/r/tea/comments/196guef/has_anyone_else_tasted_assam_tea_leaves_from_top/
1965w44,White2Tea mini-cake,15,5,,,mentel42,https://www.reddit.com/gallery/1965w44
1960lxf,How much money do you spend on tea per year?,28,53,,"I’ve been loving my teas, generally getting my teas from local shops that do anywhere from 15/oz to 60/oz for the most expensive. Generally it ends up being around 200/quarter for me, or 800/year. This made me wonder how much others spend on their tea per year",PlayfulRemote9,https://www.reddit.com/r/tea/comments/1960lxf/how_much_money_do_you_spend_on_tea_per_year/
195zibs,Little teapot as Christmas present!,30,4,image,,SignorAlighieri,https://i.redd.it/obbtnc4r5acc1.jpeg
196k18i,foil lined vs non,1,2,,"Yeah, I drink a lot of bagged tea although I have a lot of loose stuff as well. Why? It's convenient. I plop a bag in the cup, push the button on my Zojirushi hot water pot, and bam...

My question is about bag packets. I recently got some EB style teas and they came without individual sealed packets. Just loose bags. How important is getting tea bags in individually sealed packets vs non? How fast do unpacketed tea bags get stale just sitting in a basket in the kitchen?

I go through about 6 bags a day so they don't sit too long.....",apk71,https://www.reddit.com/r/tea/comments/196k18i/foil_lined_vs_non/
19668bi,Anyone know what this seed is?,12,5,image,I ordered a raw pu erh tester from White2Tea and I found two of these seeds in one of the cakes so far. Anyone know what this is? Should I not drink this anymore?,Jaoush29,https://i.redd.it/sp5gfl8krbcc1.jpeg
196j0rj,Decaf tea,0,5,,"I've never had decaf tea before (not herbal, I've had herbal).  Are decaf teas good?  I ask because I hate decaf coffee, but I'm at a point in my life even green tea keeps me up at night.  Does decaf tea taste just like regular tea?  I only like loose leaf, if that helps.",No_Rutabaga_8502,https://www.reddit.com/r/tea/comments/196j0rj/decaf_tea/
196i2a0,Could you please help me to identify these 2 teapots? Thank you!,1,0,,,SuggestionMain5725,https://www.reddit.com/gallery/195u29x
1960a0x,I stirred my tea and a face appeared,20,8,image,,duckfav,https://i.redd.it/qjb8zkp3cacc1.jpeg
196hek1,Tea ident,2,2,,"Hi, was gifted this tea without any info 

1. what’s the name of it 
2. how much teaspoons per liter 
3. how long should it brew 

Thanks in advance",StreetCost6496,https://www.reddit.com/gallery/196hek1
195zb8a,Brewing suggestions,12,16,image,"Does anyone have any digestions on how to brew this tea? I did a first steep for 5 seconds with boiling water, then a second for 30 seconds. The first steep was really good but lightly flavored. The second was pretty bad.",One_Individual9323,https://i.redd.it/4nb7bnnf4acc1.jpeg
196dnkr,Need help,1,3,,Is there any way how to get rid off sandalwoood taste  out of my tea cake? Lets say i have made some bad incensne dicissions. Advice appreciated. Thank you.,kolosmm,https://www.reddit.com/r/tea/comments/196dnkr/need_help/
195wm2c,Tazo Berry Blossom White Stash,16,6,image,"When I first noticed BBW was hard to find (6 years ago maybe?) I ordered four 6-packs of boxes from Amazon. I thought I had finished it years ago, but we just moved and I found long lost tazo boxes filled with BBW!!! 5 here and 5 more in the garage! I’m on Cloud 9!! If anyone lives in the Bay Area I’m willing to share a couple bags for nostalgias sake.",kimmigibbler420,https://i.redd.it/cum4zbiaj9cc1.jpeg
196co8k,"Reproducing Sirocco Black Chai, proportions?",1,2,image,"Hi Everyone!

I’m trying to reproduce the flavor of this specific tea and I’m looking for proportions’ suggestions. Unfortunately I can’t get hold of it off-the-shelf at the moment so I thought I could try to reproduce it, just for myself and only using the known list of ingredients, so hopefully, not infringing anything here :)

* Indian black tea
* ginger 
* cinnamon 
* cardamom seeds 
* cloves
* cardamom 
* black pepper 

Any suggestions on possible proportions of those? I guess I can start with e.g. 100g of the leafed black tea..",_shadysand_,https://i.redd.it/80e8ui0zqdcc1.jpeg
195q9xr,I just opened this herbal tea - is that mold?,28,15,image,,underscorefab,https://i.redd.it/fbnlks6y58cc1.jpeg
1968jcj,What to stir with?,2,5,,"Hey y'all!

For ages I've used metal teaspoons to stir my tea (whether it's milk, sugar, honey, etc), but I recently realized that's hard on my cups. Is there a better option that won't scratch my cups? Not the biggest deal in the world, but I am curious.

Thanks in advance!",hetscissor,https://www.reddit.com/r/tea/comments/1968jcj/what_to_stir_with/
195buxu,'A lie': Starbucks sued over claims about ethically sourced tea,336,37,link,,OilDeathServant,https://www.usatoday.com/story/money/2024/01/11/national-consumers-league-starbucks-lawsuit-coffee-tea-ethical-sourcing/72190838007/
196bgb8,"Stored tea in paper bag for weeks, has it gone bad?",0,6,,"So I got a whole bunch of new loose leaf tea and stored most of it correctly in tea tins but I didn’t have enough tins so left the green tea in the paper bag it came in (says on package to not leave it in there for too long and to store properly), and I forgot it for 3 weeks, just stored it properly today. Has it gone bad or lost some potency or something? Or what has happened to it? Was expensive so hope I didn’t ruin it!",MonitorAppropriate72,https://www.reddit.com/r/tea/comments/196bgb8/stored_tea_in_paper_bag_for_weeks_has_it_gone_bad/
195qckw,Guess the Tea - Level 2,22,5,,https://www.instagram.com/omniiac,Omniiac,https://www.reddit.com/gallery/195qckw
195rd2j,What contraptions do you use to strain loose leaf tea?,15,71,,The little tea balls you get from Amazon are too big and let finer loose teas into the water. Anyone else use a better method.,DefiantRanger9,https://www.reddit.com/r/tea/comments/195rd2j/what_contraptions_do_you_use_to_strain_loose_leaf/
195vmgi,Why is tea hit or miss (same brand same flavor),6,14,,"I’ve been drinking mighty leaf, organic breakfast a lot (black tea). There are times when the aroma is delicious and sweet, without having added anything. Other times it just tastes bland. Does it have to do with the leaf, can they taste so different even from the same batch?",valkener1,https://www.reddit.com/r/tea/comments/195vmgi/why_is_tea_hit_or_miss_same_brand_same_flavor/
195zmwi,Trying to find a supplier for this white tea,3,2,image,,Cateotu,https://i.redd.it/sm85px1t6acc1.jpeg
1962gfu,black vs dark vs puerh,2,5,,"so ive seen a few videos where they've mentioned 'dark tea' aswell as black tea but I'm rly confused as to what that is bcs its always labelled as one of the 6 main types, i saw someone say dark tea is just puerh tho? I'm very confused plz help lmao",Inevitable-Lobster02,https://www.reddit.com/r/tea/comments/1962gfu/black_vs_dark_vs_puerh/
1960kx9,Galpaditenne Ceylon OP grade review,2,0,,"My last Ceylon was from Lumpini farms and it was very different Ceylon. It wasn't bad, but it wasn't what i was looking for. It had strong plum like taste and the finish wasn't dry at all but had a taste that reminded me of the Fall. Idk if that makes sense but that's the best way for me to describe it.

Now i bought Ceylon from Galpaditenne farms and this is the one that defines Ceylon. It has that redcurrant taste, combined with slight spiceness, its sweet, sour, very slightly salty and minerally at the same time and has very strong dry finish. This is the one i have been looking for and its really cheap. 5€ for 50g, which is close to grocery store tea price here. For comparison, higher end Chinese blacks are closer to 10€ per 50g, and considering how good this is i would honestly pay as much for this.

5/5, would recommend.",1Meter_long,https://www.reddit.com/r/tea/comments/1960kx9/galpaditenne_ceylon_op_grade_review/
195vbhu,Where should I buy a tea pet?,4,15,,"I have no clue what sources are best for teapets.

Edit: I'm also looking for recommendations on a tea tray",Kitchen_Film1904,https://www.reddit.com/r/tea/comments/195vbhu/where_should_i_buy_a_tea_pet/
195s7pm,High quality Assam,7,11,,"Hi guys, Ive only bought Harney and sons tea and I want to buy higher quality tea. I really love Assam tea. I love the malty flavor and mixing it with milk. Can you recommend a high quality Assam? I'm thinking is going to be even more flavorful than the Harney and sons Assam.",LyraPeach,https://www.reddit.com/r/tea/comments/195s7pm/high_quality_assam/
